{
  "schema_version": 1,
  "benchmark": "realm-create-drop",
  "date_utc": "2026-09-10T06:30:06Z",
  "environment": {
    "host": "pt-worker",
    "kernel": "Linux version 7.0.0-28-generic (buildd@lcy02-amd64-004) (x86_64-linux-gnu-gcc-13 (Ubuntu 13.3.0-6ubuntu2~24.04.1) 13.3.0, GNU ld (GNU Binutils for Ubuntu) 2.42) #28~24.04.1-Ubuntu SMP PREEMPT_DYNAMIC Wed Jul  1 15:50:57 UTC 2",
    "cpu_model": "Intel(R) Core(TM) i9-10900KF CPU @ 3.70GHz",
    "cpu_cores": 20,
    "mem_total_kib": 131813264,
    "loadavg": [
      8.31,
      8.89,
      8.37
    ],
    "git_commit": "b8d8f5e52325f56e841cb653562da371aef83136",
    "git_dirty": true,
    "rustc": "rustc 1.99.0-nightly (9f36de775 2026-07-19)",
    "cargo_profile": "test-ci",
    "display": null,
    "date_utc": "2026-09-10T06:30:06Z"
  },
  "parameters": {
    "executed_iterations": 105,
    "warm_samples": 100,
    "budget_ms": 120000.0,
    "warmup": 5,
    "iterations": 100
  },
  "metrics": [
    {
      "name": "engine_and_runtime_init",
      "unit": "ms",
      "kind": "latency",
      "higher_is_better": false,
      "phase": "cold",
      "n": 1,
      "min": 16.68786,
      "p50": 16.68786,
      "p90": 16.68786,
      "p95": 16.68786,
      "p99": 16.68786,
      "max": 16.68786,
      "mean": 16.68786,
      "cv": 0.0,
      "unstable": false,
      "samples": [
        16.68786
      ]
    },
    {
      "name": "realm_first_script_cold",
      "unit": "ms",
      "kind": "latency",
      "higher_is_better": false,
      "phase": "cold",
      "n": 1,
      "min": 0.223046,
      "p50": 0.223046,
      "p90": 0.223046,
      "p95": 0.223046,
      "p99": 0.223046,
      "max": 0.223046,
      "mean": 0.223046,
      "cv": 0.0,
      "unstable": false,
      "samples": [
        0.223046
      ]
    },
    {
      "name": "realm_wrapper_create",
      "unit": "us",
      "kind": "latency",
      "higher_is_better": false,
      "phase": "warm",
      "n": 100,
      "min": 0.27399999999999997,
      "p50": 0.316,
      "p90": 0.351,
      "p95": 0.369,
      "p99": 2.138,
      "max": 2.4779999999999998,
      "mean": 0.35980999999999996,
      "cv": 0.779971682649734,
      "unstable": true,
      "samples": [
        0.301,
        0.328,
        0.316,
        0.3,
        0.307,
        0.312,
        0.29400000000000004,
        0.34900000000000003,
        0.339,
        0.345,
        0.28500000000000003,
        0.46199999999999997,
        0.318,
        0.33599999999999997,
        0.3,
        0.28900000000000003,
        0.27399999999999997,
        0.332,
        0.3,
        0.332,
        0.29200000000000004,
        0.31,
        0.332,
        2.138,
        0.322,
        0.36,
        0.376,
        0.291,
        0.27799999999999997,
        0.32599999999999996,
        0.32599999999999996,
        0.314,
        0.345,
        0.34900000000000003,
        0.312,
        0.33099999999999996,
        0.32099999999999995,
        0.313,
        0.322,
        0.32,
        0.337,
        0.295,
        0.293,
        0.3,
        0.38299999999999995,
        0.303,
        0.325,
        0.29400000000000004,
        0.34299999999999997,
        0.305,
        0.358,
        0.291,
        0.302,
        0.307,
        0.33599999999999997,
        0.29900000000000004,
        0.34299999999999997,
        0.30400000000000005,
        0.29200000000000004,
        0.308,
        0.334,
        0.322,
        0.365,
        0.34900000000000003,
        0.323,
        2.4779999999999998,
        0.33099999999999996,
        0.35,
        0.283,
        0.346,
        0.295,
        0.33799999999999997,
        0.337,
        0.28500000000000003,
        0.298,
        0.32099999999999995,
        0.33099999999999996,
        0.30400000000000005,
        0.308,
        0.32,
        0.307,
        0.311,
        0.351,
        0.295,
        0.28700000000000003,
        0.324,
        0.295,
        0.301,
        0.313,
        0.316,
        0.306,
        0.314,
        0.302,
        0.312,
        0.34099999999999997,
        0.355,
        0.348,
        0.303,
        0.298,
        0.369
      ]
    },
    {
      "name": "realm_create_first_script",
      "unit": "us",
      "kind": "latency",
      "higher_is_better": false,
      "phase": "warm",
      "n": 100,
      "min": 121.64500000000001,
      "p50": 150.97400000000002,
      "p90": 163.43200000000002,
      "p95": 287.883,
      "p99": 1439.0,
      "max": 1451.9820000000002,
      "mean": 193.77990000000003,
      "cv": 1.1340759034688603,
      "unstable": true,
      "samples": [
        147.976,
        150.268,
        153.36,
        151.418,
        162.745,
        151.704,
        146.208,
        151.584,
        144.939,
        151.894,
        291.994,
        159.65099999999998,
        139.35799999999998,
        144.973,
        142.879,
        147.31799999999998,
        145.428,
        150.14999999999998,
        121.64500000000001,
        128.33,
        144.102,
        146.778,
        146.78400000000002,
        149.45499999999998,
        144.17100000000002,
        161.39600000000002,
        166.73999999999998,
        148.742,
        142.369,
        143.70999999999998,
        142.107,
        154.079,
        154.071,
        144.21900000000002,
        153.273,
        149.599,
        142.378,
        153.942,
        173.127,
        152.119,
        145.48299999999998,
        287.883,
        145.38400000000001,
        1451.9820000000002,
        152.303,
        147.691,
        158.575,
        163.181,
        158.779,
        155.197,
        147.492,
        149.972,
        144.91400000000002,
        155.823,
        147.45000000000002,
        157.847,
        145.71,
        150.817,
        146.548,
        151.077,
        159.531,
        159.227,
        152.122,
        163.43200000000002,
        150.45600000000002,
        157.198,
        150.593,
        149.928,
        1415.117,
        148.642,
        288.219,
        150.223,
        151.936,
        144.113,
        157.72,
        149.644,
        151.344,
        146.859,
        158.07000000000002,
        151.213,
        153.12,
        146.056,
        155.66899999999998,
        149.01500000000001,
        147.491,
        166.262,
        152.943,
        147.03900000000002,
        161.249,
        152.083,
        151.63899999999998,
        174.78400000000002,
        145.532,
        1439.0,
        149.256,
        158.07500000000002,
        161.259,
        144.9,
        154.966,
        150.97400000000002
      ]
    },
    {
      "name": "realm_cycle",
      "unit": "us",
      "kind": "latency",
      "higher_is_better": false,
      "phase": "warm",
      "n": 100,
      "min": 122.07300000000001,
      "p50": 151.53799999999998,
      "p90": 163.921,
      "p95": 288.307,
      "p99": 1439.4689999999998,
      "max": 1452.439,
      "mean": 194.28630999999993,
      "cv": 1.131062594050947,
      "unstable": true,
      "samples": [
        148.60999999999999,
        150.752,
        153.82000000000002,
        151.85600000000002,
        163.19799999999998,
        152.16600000000003,
        146.656,
        152.07,
        145.42399999999998,
        152.382,
        292.48800000000006,
        160.24899999999997,
        139.826,
        145.44500000000002,
        143.305,
        147.74999999999997,
        145.83599999999998,
        150.63099999999997,
        122.07300000000001,
        128.811,
        144.546,
        147.22,
        147.27300000000002,
        151.738,
        144.62900000000002,
        161.89500000000004,
        167.26899999999998,
        149.18499999999997,
        142.79899999999998,
        144.16099999999997,
        142.572,
        154.514,
        154.542,
        144.69400000000002,
        153.733,
        150.07799999999997,
        142.867,
        154.40699999999998,
        173.602,
        152.596,
        145.96199999999996,
        288.307,
        145.81900000000002,
        1452.439,
        152.826,
        148.136,
        159.05499999999998,
        163.65200000000002,
        159.266,
        155.661,
        147.995,
        150.40800000000002,
        145.356,
        156.26399999999998,
        147.92400000000004,
        158.29000000000002,
        146.20499999999998,
        151.274,
        146.995,
        151.53799999999998,
        160.032,
        159.687,
        152.62500000000003,
        163.921,
        150.925,
        159.83,
        151.07899999999998,
        150.42399999999998,
        1415.523,
        149.107,
        288.639,
        150.693,
        152.396,
        144.541,
        158.153,
        150.089,
        151.83499999999998,
        147.29500000000002,
        158.507,
        151.683,
        153.571,
        146.562,
        156.159,
        149.439,
        147.92900000000003,
        166.738,
        153.349,
        147.458,
        161.70499999999998,
        152.529,
        152.089,
        175.24200000000002,
        145.985,
        1439.4689999999998,
        149.758,
        158.577,
        161.762,
        145.349,
        155.453,
        151.484
      ]
    }
  ],
  "notes": [
    "realm = lazily-created global object per JsContext wrapper over the shared thread SM Runtime (realm-per-context model); SM JSContext itself is not destroyed per iteration",
    "dropped realm globals are unrooted and reclaimed by GC — accumulation pressure during the run is honest GC workload, not a leak verdict"
  ]
}