{
  "schema_version": 1,
  "benchmark": "rss-sample",
  "date_utc": "2026-09-10T06:30:36Z",
  "environment": {
    "host": "pt-worker",
    "kernel": "Linux version 7.0.0-28-generic (buildd@lcy02-amd64-004) (x86_64-linux-gnu-gcc-13 (Ubuntu 13.3.0-6ubuntu2~24.04.1) 13.3.0, GNU ld (GNU Binutils for Ubuntu) 2.42) #28~24.04.1-Ubuntu SMP PREEMPT_DYNAMIC Wed Jul  1 15:50:57 UTC 2",
    "cpu_model": "Intel(R) Core(TM) i9-10900KF CPU @ 3.70GHz",
    "cpu_cores": 20,
    "mem_total_kib": 131813264,
    "loadavg": [
      6.72,
      8.44,
      8.23
    ],
    "git_commit": "b8d8f5e52325f56e841cb653562da371aef83136",
    "git_dirty": true,
    "rustc": "rustc 1.99.0-nightly (9f36de775 2026-07-19)",
    "cargo_profile": "test-ci",
    "display": null,
    "date_utc": "2026-09-10T06:30:36Z"
  },
  "parameters": {
    "churn_secs": 8,
    "idle_secs": 3,
    "churn_iterations_js": 3041755.0,
    "post_secs": 3,
    "interval_ms": 200,
    "churn_eval_ms": 8000.267299000001,
    "probe_count": 71
  },
  "metrics": [
    {
      "name": "runtime_init",
      "unit": "ms",
      "kind": "latency",
      "higher_is_better": false,
      "phase": "cold",
      "n": 1,
      "min": 17.38985,
      "p50": 17.38985,
      "p90": 17.38985,
      "p95": 17.38985,
      "p99": 17.38985,
      "max": 17.38985,
      "mean": 17.38985,
      "cv": 0.0,
      "unstable": false,
      "samples": [
        17.38985
      ]
    },
    {
      "name": "vm_rss_idle",
      "unit": "KiB",
      "kind": "memory",
      "higher_is_better": false,
      "n": 15,
      "min": 51632.0,
      "p50": 51636.0,
      "p90": 51640.0,
      "p95": 51640.0,
      "p99": 51640.0,
      "max": 51640.0,
      "mean": 51636.8,
      "cv": 0.0000645017816585422,
      "unstable": false,
      "samples": [
        51632.0,
        51632.0,
        51632.0,
        51632.0,
        51636.0,
        51636.0,
        51636.0,
        51636.0,
        51640.0,
        51640.0,
        51640.0,
        51640.0,
        51640.0,
        51640.0,
        51640.0
      ]
    },
    {
      "name": "vm_rss_churn",
      "unit": "KiB",
      "kind": "memory",
      "higher_is_better": false,
      "n": 40,
      "min": 59328.0,
      "p50": 69364.0,
      "p90": 70720.0,
      "p95": 70720.0,
      "p99": 70820.0,
      "max": 70820.0,
      "mean": 67841.5,
      "cv": 0.04760823315743384,
      "unstable": false,
      "samples": [
        59328.0,
        61344.0,
        61496.0,
        62144.0,
        62500.0,
        63048.0,
        63592.0,
        64192.0,
        64784.0,
        65384.0,
        65972.0,
        66564.0,
        67192.0,
        67776.0,
        68368.0,
        68956.0,
        69556.0,
        70156.0,
        69364.0,
        69364.0,
        69364.0,
        69364.0,
        69448.0,
        69324.0,
        69324.0,
        69764.0,
        69416.0,
        69648.0,
        69880.0,
        70376.0,
        70772.0,
        70488.0,
        70612.0,
        70612.0,
        70612.0,
        70596.0,
        70720.0,
        70720.0,
        70720.0,
        70820.0
      ]
    },
    {
      "name": "vm_rss_post",
      "unit": "KiB",
      "kind": "memory",
      "higher_is_better": false,
      "n": 15,
      "min": 70844.0,
      "p50": 70844.0,
      "p90": 70852.0,
      "p95": 70852.0,
      "p99": 70852.0,
      "max": 70852.0,
      "mean": 70847.2,
      "cv": 0.000055318821187754564,
      "unstable": false,
      "samples": [
        70844.0,
        70844.0,
        70844.0,
        70844.0,
        70844.0,
        70844.0,
        70844.0,
        70844.0,
        70844.0,
        70852.0,
        70852.0,
        70852.0,
        70852.0,
        70852.0,
        70852.0
      ]
    },
    {
      "name": "vm_rss_slope_churn",
      "unit": "KiB_per_s",
      "kind": "memory",
      "higher_is_better": false,
      "n": 1,
      "min": 1472.3591767087753,
      "p50": 1472.3591767087753,
      "p90": 1472.3591767087753,
      "p95": 1472.3591767087753,
      "p99": 1472.3591767087753,
      "max": 1472.3591767087753,
      "mean": 1472.3591767087753,
      "cv": 0.0,
      "unstable": false,
      "samples": [
        1472.3591767087753
      ]
    },
    {
      "name": "vm_rss_slope_post",
      "unit": "KiB_per_s",
      "kind": "memory",
      "higher_is_better": false,
      "n": 1,
      "min": 2.8526563764661685,
      "p50": 2.8526563764661685,
      "p90": 2.8526563764661685,
      "p95": 2.8526563764661685,
      "p99": 2.8526563764661685,
      "max": 2.8526563764661685,
      "mean": 2.8526563764661685,
      "cv": 0.0,
      "unstable": false,
      "samples": [
        2.8526563764661685
      ]
    },
    {
      "name": "vm_hwm_peak",
      "unit": "KiB",
      "kind": "memory",
      "higher_is_better": false,
      "n": 1,
      "min": 70968.0,
      "p50": 70968.0,
      "p90": 70968.0,
      "p95": 70968.0,
      "p99": 70968.0,
      "max": 70968.0,
      "mean": 70968.0,
      "cv": 0.0,
      "unstable": false,
      "samples": [
        70968.0
      ]
    },
    {
      "name": "fd_count_max",
      "unit": "count",
      "kind": "count",
      "higher_is_better": false,
      "n": 1,
      "min": 4.0,
      "p50": 4.0,
      "p90": 4.0,
      "p95": 4.0,
      "p99": 4.0,
      "max": 4.0,
      "mean": 4.0,
      "cv": 0.0,
      "unstable": false,
      "samples": [
        4.0
      ]
    },
    {
      "name": "thread_count_max",
      "unit": "count",
      "kind": "count",
      "higher_is_better": false,
      "n": 1,
      "min": 10.0,
      "p50": 10.0,
      "p90": 10.0,
      "p95": 10.0,
      "p99": 10.0,
      "max": 10.0,
      "mean": 10.0,
      "cv": 0.0,
      "unstable": false,
      "samples": [
        10.0
      ]
    }
  ],
  "notes": [
    "slopes are observations for issue #19 G budgets — monotonic growth must be attributable before any gate consumes them; SM does not return heap to the OS eagerly",
    "churn is a synchronous blocking eval (arrays + strings + Math.random) — no timers/network, no event-loop dependency"
  ]
}