{
  "schema_version": 1,
  "benchmark": "runtime-create-drop",
  "date_utc": "2026-09-10T06:30:06Z",
  "environment": {
    "host": "pt-worker",
    "kernel": "Linux version 7.0.0-28-generic (buildd@lcy02-amd64-004) (x86_64-linux-gnu-gcc-13 (Ubuntu 13.3.0-6ubuntu2~24.04.1) 13.3.0, GNU ld (GNU Binutils for Ubuntu) 2.42) #28~24.04.1-Ubuntu SMP PREEMPT_DYNAMIC Wed Jul  1 15:50:57 UTC 2",
    "cpu_model": "Intel(R) Core(TM) i9-10900KF CPU @ 3.70GHz",
    "cpu_cores": 20,
    "mem_total_kib": 131813264,
    "loadavg": [
      8.31,
      8.89,
      8.37
    ],
    "git_commit": "b8d8f5e52325f56e841cb653562da371aef83136",
    "git_dirty": true,
    "rustc": "rustc 1.99.0-nightly (9f36de775 2026-07-19)",
    "cargo_profile": "test-ci",
    "display": null,
    "date_utc": "2026-09-10T06:30:06Z"
  },
  "parameters": {
    "warmup": 3,
    "budget_ms": 120000.0,
    "eval_source": "1+1",
    "executed_iterations": 54,
    "warm_samples": 50,
    "iterations": 50
  },
  "metrics": [
    {
      "name": "runtime_create_cold",
      "unit": "ms",
      "kind": "latency",
      "higher_is_better": false,
      "phase": "cold",
      "n": 1,
      "min": 16.81531,
      "p50": 16.81531,
      "p90": 16.81531,
      "p95": 16.81531,
      "p99": 16.81531,
      "max": 16.81531,
      "mean": 16.81531,
      "cv": 0.0,
      "unstable": false,
      "samples": [
        16.81531
      ]
    },
    {
      "name": "runtime_first_eval_cold",
      "unit": "ms",
      "kind": "latency",
      "higher_is_better": false,
      "phase": "cold",
      "n": 1,
      "min": 16.020522,
      "p50": 16.020522,
      "p90": 16.020522,
      "p95": 16.020522,
      "p99": 16.020522,
      "max": 16.020522,
      "mean": 16.020522,
      "cv": 0.0,
      "unstable": false,
      "samples": [
        16.020522
      ]
    },
    {
      "name": "runtime_drop_cold",
      "unit": "ms",
      "kind": "latency",
      "higher_is_better": false,
      "phase": "cold",
      "n": 1,
      "min": 0.969862,
      "p50": 0.969862,
      "p90": 0.969862,
      "p95": 0.969862,
      "p99": 0.969862,
      "max": 0.969862,
      "mean": 0.969862,
      "cv": 0.0,
      "unstable": false,
      "samples": [
        0.969862
      ]
    },
    {
      "name": "runtime_cycle_cold",
      "unit": "ms",
      "kind": "latency",
      "higher_is_better": false,
      "phase": "cold",
      "n": 1,
      "min": 33.805693999999995,
      "p50": 33.805693999999995,
      "p90": 33.805693999999995,
      "p95": 33.805693999999995,
      "p99": 33.805693999999995,
      "max": 33.805693999999995,
      "mean": 33.805693999999995,
      "cv": 0.0,
      "unstable": false,
      "samples": [
        33.805693999999995
      ]
    },
    {
      "name": "runtime_create",
      "unit": "ms",
      "kind": "latency",
      "higher_is_better": false,
      "phase": "warm",
      "n": 50,
      "min": 6.3033209999999995,
      "p50": 6.471712,
      "p90": 6.7547299999999995,
      "p95": 7.310734,
      "p99": 8.137575,
      "max": 8.137575,
      "mean": 6.555048660000001,
      "cv": 0.04684166850031143,
      "unstable": false,
      "samples": [
        6.356121,
        6.384515,
        6.515211,
        6.624668,
        6.777436000000001,
        6.552732000000001,
        6.54103,
        6.5348239999999995,
        6.7714170000000005,
        6.535242,
        6.4649779999999994,
        6.469567,
        6.421807,
        6.3648940000000005,
        6.375908,
        6.348401,
        6.412119,
        6.330577000000001,
        6.306276,
        6.466507,
        6.3033209999999995,
        6.338679,
        6.471712,
        6.378507,
        6.395013,
        6.493228,
        6.375446,
        6.366989,
        6.514235,
        6.358797999999999,
        6.42009,
        6.400434,
        7.427733,
        6.61149,
        6.618261,
        6.4421100000000004,
        6.5139309999999995,
        8.137575,
        6.5903350000000005,
        6.626175,
        6.7547299999999995,
        6.51767,
        7.310734,
        6.591087,
        6.586036,
        6.573665999999999,
        6.461723,
        6.597964,
        6.564516,
        6.456015
      ]
    },
    {
      "name": "runtime_first_eval",
      "unit": "ms",
      "kind": "latency",
      "higher_is_better": false,
      "phase": "warm",
      "n": 50,
      "min": 14.936871,
      "p50": 15.1521,
      "p90": 15.604270999999999,
      "p95": 15.818613,
      "p99": 17.52175,
      "max": 17.52175,
      "mean": 15.294544140000001,
      "cv": 0.02594315244816154,
      "unstable": false,
      "samples": [
        15.138507,
        15.326262,
        15.818613,
        15.299708,
        15.096191,
        15.397654000000001,
        15.47702,
        15.233406,
        15.278202,
        15.495314,
        15.294953,
        15.1521,
        15.033603,
        14.936871,
        15.320382,
        15.046175,
        15.02444,
        15.065095000000001,
        14.981766,
        14.957722,
        14.989267,
        15.027818,
        15.093363,
        15.085734,
        15.044782,
        15.125076,
        15.114468,
        15.104882,
        14.997829000000001,
        15.04073,
        14.992679,
        15.093307,
        15.044172,
        15.261992000000001,
        15.101023999999999,
        15.140025,
        15.416628999999999,
        15.478968,
        15.911957000000001,
        15.471227,
        15.298751,
        15.421431,
        17.52175,
        15.604270999999999,
        15.398404,
        15.816987000000001,
        15.709758,
        15.422096999999999,
        15.361915999999999,
        15.261929
      ]
    },
    {
      "name": "runtime_drop",
      "unit": "ms",
      "kind": "latency",
      "higher_is_better": false,
      "phase": "warm",
      "n": 50,
      "min": 0.8242320000000001,
      "p50": 0.9374239999999999,
      "p90": 1.006002,
      "p95": 1.077745,
      "p99": 1.1183589999999999,
      "max": 1.1183589999999999,
      "mean": 0.9447272,
      "cv": 0.06564152033790353,
      "unstable": false,
      "samples": [
        0.891194,
        0.955457,
        1.105399,
        1.0052839999999998,
        0.8242320000000001,
        0.9286,
        0.9015479999999999,
        0.9973829999999999,
        0.97403,
        0.956111,
        0.862214,
        0.828016,
        0.923468,
        0.880898,
        0.847691,
        0.942592,
        0.939479,
        0.943068,
        0.901065,
        0.900062,
        0.9374239999999999,
        0.9620810000000001,
        0.932648,
        0.959785,
        0.990517,
        0.927384,
        0.975651,
        0.9948839999999999,
        0.8747619999999999,
        0.992445,
        0.920299,
        0.923118,
        0.8749880000000001,
        1.077745,
        0.890383,
        0.9316720000000001,
        1.0018239999999998,
        1.0459180000000001,
        0.9611510000000001,
        0.949087,
        0.9531919999999999,
        1.1183589999999999,
        0.948689,
        1.006002,
        0.92547,
        1.015256,
        0.930041,
        0.874368,
        0.935867,
        0.897559
      ]
    },
    {
      "name": "runtime_cycle",
      "unit": "ms",
      "kind": "latency",
      "higher_is_better": false,
      "phase": "warm",
      "n": 50,
      "min": 22.182662999999998,
      "p50": 22.615503,
      "p90": 23.346893,
      "p95": 23.463443,
      "p99": 25.781173000000003,
      "max": 25.781173000000003,
      "mean": 22.79432,
      "cv": 0.026845546562066887,
      "unstable": false,
      "samples": [
        22.385821999999997,
        22.666234,
        23.439223,
        22.929660000000002,
        22.697858999999998,
        22.878986,
        22.919597999999997,
        22.765613,
        23.023649,
        22.986667,
        22.622145,
        22.449683000000004,
        22.378878,
        22.182662999999998,
        22.543981000000002,
        22.337168000000002,
        22.376037999999998,
        22.33874,
        22.189107,
        22.324291,
        22.230012,
        22.328578,
        22.497723,
        22.424026,
        22.430312,
        22.545688000000002,
        22.465564999999998,
        22.466755,
        22.386826000000003,
        22.391973,
        22.333068,
        22.416859,
        23.346893,
        22.951227000000003,
        22.609668,
        22.513807,
        22.932384,
        24.662461,
        23.463443,
        23.046489,
        23.006673,
        23.05746,
        25.781173000000003,
        23.201359999999998,
        22.90991,
        23.405909,
        23.101522,
        22.894429,
        22.862299,
        22.615503
      ]
    },
    {
      "name": "runtime_cycles_per_s_wall",
      "unit": "ops_per_s",
      "kind": "throughput",
      "higher_is_better": true,
      "n": 1,
      "min": 40.18230722431425,
      "p50": 40.18230722431425,
      "p90": 40.18230722431425,
      "p95": 40.18230722431425,
      "p99": 40.18230722431425,
      "max": 40.18230722431425,
      "mean": 40.18230722431425,
      "cv": 0.0,
      "unstable": false,
      "samples": [
        40.18230722431425
      ]
    }
  ],
  "notes": [
    "warm first_eval includes lazy realm-global creation + install_all Node/Bun globals (per-realm cost, not per-eval)",
    "drop = SmRuntimeGuard drop (JS_DestroyContext + CONTEXT TLS take); process JSEngine singleton survives across iterations"
  ]
}